{
  "version": "0.1",
  "run_id": "run_aa23ab08ac",
  "scenario_id": "regime_stress_v0",
  "seed": 7,
  "start_time_utc": "2026-03-18T21:11:45.515133Z",
  "events": [
    {
      "seq": 0,
      "ts": 0.006531205202969747,
      "type": "coordination_message",
      "actor": {
        "kind": "system",
        "id": "scheduler"
      },
      "payload": {
        "detail": "assign_task",
        "task_id": "receive_sample:0"
      },
      "state_hash_after": "b214ab65adc3ba8a83fc9daa540ff179100008a305fc4144936c77783af6d072"
    },
    {
      "seq": 1,
      "ts": 0.009260395298643547,
      "type": "task_start",
      "actor": {
        "kind": "agent",
        "id": "agent_1"
      },
      "payload": {
        "task_id": "receive_sample:0",
        "name": "receive_sample"
      },
      "state_hash_after": "b399f7cb3095b80e85ed05b05cce725373eca0dd73aa93672da0ef38ab30240c"
    },
    {
      "seq": 2,
      "ts": 0.010515410539887707,
      "type": "task_end",
      "actor": {
        "kind": "tool",
        "id": "lab_device_1"
      },
      "payload": {
        "task_id": "receive_sample:0",
        "name": "receive_sample"
      },
      "state_hash_after": "5b0650124328920a23401302b7680e5de8e1228feae6961531f65bccf57198ac"
    },
    {
      "seq": 3,
      "ts": 0.02332724397370594,
      "type": "coordination_message",
      "actor": {
        "kind": "system",
        "id": "scheduler"
      },
      "payload": {
        "detail": "assign_task",
        "task_id": "centrifuge:1"
      },
      "state_hash_after": "5a9477e5978c0c24864e01b2cc2e69fcefe663c78a339846e4c2857c3e81605c"
    },
    {
      "seq": 4,
      "ts": 0.03092498195535159,
      "type": "task_start",
      "actor": {
        "kind": "agent",
        "id": "agent_1"
      },
      "payload": {
        "task_id": "centrifuge:1",
        "name": "centrifuge"
      },
      "state_hash_after": "015e89533d3c784608da5c34517ad1018a2254e4814ebbb77f3cc38890457fd8"
    },
    {
      "seq": 5,
      "ts": 0.042743967619533814,
      "type": "fault_injected",
      "actor": {
        "kind": "system",
        "id": "fault_injector"
      },
      "payload": {
        "fault": "drop_completion",
        "task_id": "centrifuge:1"
      },
      "state_hash_after": "034d5146ed367aeb888a0ce4a491fa1166e0b06334dc642b0b3893ee54d9e943"
    },
    {
      "seq": 6,
      "ts": 0.043381820048105584,
      "type": "coordination_message",
      "actor": {
        "kind": "system",
        "id": "scheduler"
      },
      "payload": {
        "detail": "assign_task",
        "task_id": "analyze:2"
      },
      "state_hash_after": "209e80de4698850efc8b27eea3cc774c23f3c773160bd8d44fdf1cadbedd97cc"
    },
    {
      "seq": 7,
      "ts": 0.05287090892727669,
      "type": "task_start",
      "actor": {
        "kind": "agent",
        "id": "agent_1"
      },
      "payload": {
        "task_id": "analyze:2",
        "name": "analyze"
      },
      "state_hash_after": "9711d7c592e4fda7e1ad34d1417bd759eca41d4ef2c59dbb96f8ca777e58183a"
    },
    {
      "seq": 8,
      "ts": 0.05445807542040419,
      "type": "fault_injected",
      "actor": {
        "kind": "system",
        "id": "fault_injector"
      },
      "payload": {
        "fault": "drop_completion",
        "task_id": "analyze:2"
      },
      "state_hash_after": "3cbb124ae1903c08d9613a8423c629a7707804ea3b02929c0042f9627837f42a"
    },
    {
      "seq": 9,
      "ts": 0.06368035138413818,
      "type": "coordination_message",
      "actor": {
        "kind": "system",
        "id": "scheduler"
      },
      "payload": {
        "detail": "assign_task",
        "task_id": "report_results:3"
      },
      "state_hash_after": "7cc215418c892c1be5bda953b48a30c22a87569a1ea42d42288913edf4afdb34"
    },
    {
      "seq": 10,
      "ts": 0.09294880928993292,
      "type": "task_start",
      "actor": {
        "kind": "agent",
        "id": "agent_1"
      },
      "payload": {
        "task_id": "report_results:3",
        "name": "report_results"
      },
      "state_hash_after": "c0b61c0a59b508b69e4e2fb3f167ce5de70d1f4a023a624d9c57ad41888e62d0"
    },
    {
      "seq": 11,
      "ts": 0.09716518279406579,
      "type": "fault_injected",
      "actor": {
        "kind": "system",
        "id": "fault_injector"
      },
      "payload": {
        "fault": "drop_completion",
        "task_id": "report_results:3"
      },
      "state_hash_after": "44a2391242858d03a583eaaa89a91aabb7dd4d0b16b18d902c0d6453bbf08743"
    },
    {
      "seq": 12,
      "ts": 0.10716518279406578,
      "type": "regime_switch",
      "actor": {
        "kind": "system",
        "id": "meta_controller"
      },
      "payload": {
        "from_regime": "centralized",
        "to_regime": "fallback",
        "reason": "fault_threshold"
      },
      "state_hash_after": "44a2391242858d03a583eaaa89a91aabb7dd4d0b16b18d902c0d6453bbf08743"
    }
  ],
  "final_state_hash": "44a2391242858d03a583eaaa89a91aabb7dd4d0b16b18d902c0d6453bbf08743",
  "metadata": {
    "delay_p95_ms": 50.0,
    "drop_completion_prob": 0.15,
    "delay_fault_prob": 0.0,
    "calibration_invalid_prob": 0.0,
    "max_retries_per_task": 0,
    "meta_controller": true,
    "regime_switch_count": 1
  }
}
