{
  "version": "0.1",
  "run_id": "run_e8fd5823b6",
  "scenario_id": "lab_profile_v0",
  "seed": 25,
  "start_time_utc": "2026-04-20T06:22:36.323806Z",
  "events": [
    {
      "seq": 0,
      "ts": 0.007897038336761053,
      "type": "coordination_message",
      "actor": {
        "kind": "system",
        "id": "scheduler"
      },
      "payload": {
        "detail": "assign_task",
        "task_id": "receive_sample:0",
        "regime": "centralized"
      },
      "state_hash_after": "b214ab65adc3ba8a83fc9daa540ff179100008a305fc4144936c77783af6d072"
    },
    {
      "seq": 1,
      "ts": 0.05153249426757264,
      "type": "task_start",
      "actor": {
        "kind": "agent",
        "id": "agent_1"
      },
      "payload": {
        "task_id": "receive_sample:0",
        "name": "receive_sample"
      },
      "state_hash_after": "b399f7cb3095b80e85ed05b05cce725373eca0dd73aa93672da0ef38ab30240c"
    },
    {
      "seq": 2,
      "ts": 0.08580537065596586,
      "type": "fault_injected",
      "actor": {
        "kind": "system",
        "id": "fault_injector"
      },
      "payload": {
        "fault": "drop_completion",
        "task_id": "receive_sample:0"
      },
      "state_hash_after": "f9a47e999712adb805df454cac61afd5667aa54643efcecbf94faa256e31d74e"
    },
    {
      "seq": 3,
      "ts": 0.10269390835722103,
      "type": "coordination_message",
      "actor": {
        "kind": "system",
        "id": "scheduler"
      },
      "payload": {
        "detail": "assign_task",
        "task_id": "centrifuge:1",
        "regime": "centralized"
      },
      "state_hash_after": "3876ca3938ea58e020a0e0d0516a5cca789685a70771da34375aceb172ca73b5"
    },
    {
      "seq": 4,
      "ts": 0.10341688521800141,
      "type": "task_start",
      "actor": {
        "kind": "agent",
        "id": "agent_1"
      },
      "payload": {
        "task_id": "centrifuge:1",
        "name": "centrifuge"
      },
      "state_hash_after": "5b83b5d43e7822c12d4c772d0ef296938aad048107bb3136b52be385348fb750"
    },
    {
      "seq": 5,
      "ts": 0.10951123236893866,
      "type": "fault_injected",
      "actor": {
        "kind": "system",
        "id": "fault_injector"
      },
      "payload": {
        "fault": "drop_completion",
        "task_id": "centrifuge:1"
      },
      "state_hash_after": "882c83fc99fb7faf5612cea7c34fef36ab6570f44696bb018daa6a76e5c0aeb9"
    },
    {
      "seq": 6,
      "ts": 0.11872078012195698,
      "type": "coordination_message",
      "actor": {
        "kind": "system",
        "id": "scheduler"
      },
      "payload": {
        "detail": "assign_task",
        "task_id": "analyze:2",
        "regime": "centralized"
      },
      "state_hash_after": "74a7ff2af0b14bfa31113be4ebd6a7e9d4918444a11d7583ad3528a3b8a72f2d"
    },
    {
      "seq": 7,
      "ts": 0.13354153568877422,
      "type": "task_start",
      "actor": {
        "kind": "agent",
        "id": "agent_1"
      },
      "payload": {
        "task_id": "analyze:2",
        "name": "analyze"
      },
      "state_hash_after": "3e092ed3afbadac59c367cd89cd9ca0ee348687c8b18e13d6aa13822e50a68a9"
    },
    {
      "seq": 8,
      "ts": 0.14552681697048064,
      "type": "task_end",
      "actor": {
        "kind": "tool",
        "id": "lab_device_1"
      },
      "payload": {
        "task_id": "analyze:2",
        "name": "analyze"
      },
      "state_hash_after": "2e25c94a2f01967a8163b7b296fc602671d228feecbe2462d4f883183aaad574"
    },
    {
      "seq": 9,
      "ts": 0.17193302505138758,
      "type": "coordination_message",
      "actor": {
        "kind": "system",
        "id": "scheduler"
      },
      "payload": {
        "detail": "assign_task",
        "task_id": "report_results:3",
        "regime": "centralized"
      },
      "state_hash_after": "42137d8ae338f7979c99058a2c04fd8f04ea913ee5e1233a8eb987a0eea2cafa"
    },
    {
      "seq": 10,
      "ts": 0.1883025755594233,
      "type": "task_start",
      "actor": {
        "kind": "agent",
        "id": "agent_1"
      },
      "payload": {
        "task_id": "report_results:3",
        "name": "report_results"
      },
      "state_hash_after": "4e980949c08241dd05e994a23c88cfa9cbe59342d5a29a8bcbbea73351902ce6"
    },
    {
      "seq": 11,
      "ts": 0.19571683232697493,
      "type": "fault_injected",
      "actor": {
        "kind": "system",
        "id": "fault_injector"
      },
      "payload": {
        "fault": "drop_completion",
        "task_id": "report_results:3"
      },
      "state_hash_after": "29d210a954899d45127aa0793b2fa954c6aa0aecfae9baa5e3379d324b5d14c4"
    },
    {
      "seq": 12,
      "ts": 0.20629415019062605,
      "type": "coordination_message",
      "actor": {
        "kind": "system",
        "id": "scheduler"
      },
      "payload": {
        "detail": "assign_task",
        "task_id": "disposition_commit:4",
        "regime": "centralized"
      },
      "state_hash_after": "38c585638139ff57b693f3205cf52178a587d4509923d8c7861c931ec6eeccb8"
    },
    {
      "seq": 13,
      "ts": 0.2081267097420612,
      "type": "task_start",
      "actor": {
        "kind": "agent",
        "id": "agent_1"
      },
      "payload": {
        "task_id": "disposition_commit:4",
        "name": "disposition_commit"
      },
      "state_hash_after": "88f83ddafd426955c62fa58e5589da7e9bf5b576aae126216bc3dd6f443b11cb"
    },
    {
      "seq": 14,
      "ts": 0.2227163379369969,
      "type": "task_end",
      "actor": {
        "kind": "tool",
        "id": "lab_device_1"
      },
      "payload": {
        "task_id": "disposition_commit:4",
        "name": "disposition_commit"
      },
      "state_hash_after": "2491c8d2a4cf6eb0b4537dd41992363b0d77601d7db303544a12c9b2b2e684c4"
    },
    {
      "seq": 15,
      "ts": 0.23271633793699692,
      "type": "regime_switch",
      "actor": {
        "kind": "system",
        "id": "meta_controller"
      },
      "payload": {
        "from_regime": "centralized",
        "to_regime": "fallback",
        "reason": "fault_threshold",
        "criteria": {
          "fault_count": 3,
          "fault_threshold": 1,
          "hysteresis_consecutive": 1,
          "latency_p95_ms": 14.459410849274235,
          "latency_threshold_ms": 200.0,
          "contention_index": 2.5,
          "contention_threshold": 1.5
        }
      },
      "state_hash_after": "2491c8d2a4cf6eb0b4537dd41992363b0d77601d7db303544a12c9b2b2e684c4"
    }
  ],
  "final_state_hash": "2491c8d2a4cf6eb0b4537dd41992363b0d77601d7db303544a12c9b2b2e684c4",
  "metadata": {
    "delay_p95_ms": 50.0,
    "drop_completion_prob": 0.35,
    "delay_fault_prob": 0.0,
    "calibration_invalid_prob": 0.0,
    "max_retries_per_task": 0,
    "rep_cps_scheduling_dependent": false,
    "rep_cps_safety_gate_ok": null,
    "planned_task_count": 5,
    "timeout_fault_prob": 0.0,
    "partial_result_fault_prob": 0.0,
    "reordered_event_fault_prob": 0.0,
    "resource_contention_spike_prob": 0.02,
    "invalid_action_injection_prob": 0.0,
    "agent_nonresponse_fault_prob": 0.0,
    "duplicate_completion_prob": 0.0,
    "conflicting_action_prob": 0.0,
    "constraint_guard_trigger_prob": 0.0,
    "sensor_stale_prob": 0.0,
    "shutdown_after_first_fault": false,
    "deadline_miss_prob": 0.0,
    "fault_setting_label": "unknown",
    "agent_count": 1,
    "coordination_regime": "centralized",
    "coordination_topology": "centralized",
    "hierarchy_depth": 2,
    "fan_out": 1,
    "handoff_factor": 1,
    "shared_state_contention": 0.2,
    "deadline_tightness": 1.0,
    "critical_path_length": 5,
    "branching_factor": 1.0,
    "queue_contention_index": 0.2,
    "regime_fault_interaction": 0.0,
    "regime_id": 0,
    "effective_drop_completion_prob": 0.35,
    "latency_stress_multiplier": 1.0,
    "drop_stress_multiplier": 1.0,
    "meta_controller": true,
    "regime_switch_count": 1,
    "fallback_tasks_completed": 5,
    "fallback_recovery_ok": true,
    "fallback_time_to_recovery_ms": 86.12765439542171,
    "fallback_ponr_violation_count": 0,
    "fallback_safety_violation_count": 0,
    "fallback_run_recorded": true
  }
}
