{
  "version": "0.1",
  "run_id": "run_0d69874f67",
  "scenario_id": "regime_stress_v1",
  "seed": 11,
  "start_time_utc": "2026-04-20T05:56:02.585717Z",
  "events": [
    {
      "seq": 0,
      "ts": 0.010050511743206637,
      "type": "coordination_message",
      "actor": {
        "kind": "system",
        "id": "scheduler"
      },
      "payload": {
        "detail": "assign_task",
        "task_id": "receive_sample:0"
      },
      "state_hash_after": "b214ab65adc3ba8a83fc9daa540ff179100008a305fc4144936c77783af6d072"
    },
    {
      "seq": 1,
      "ts": 0.023744381998336922,
      "type": "task_start",
      "actor": {
        "kind": "agent",
        "id": "agent_1"
      },
      "payload": {
        "task_id": "receive_sample:0",
        "name": "receive_sample"
      },
      "state_hash_after": "b399f7cb3095b80e85ed05b05cce725373eca0dd73aa93672da0ef38ab30240c"
    },
    {
      "seq": 2,
      "ts": 0.03420433465716962,
      "type": "task_end",
      "actor": {
        "kind": "tool",
        "id": "lab_device_1"
      },
      "payload": {
        "task_id": "receive_sample:0",
        "name": "receive_sample"
      },
      "state_hash_after": "5b0650124328920a23401302b7680e5de8e1228feae6961531f65bccf57198ac"
    },
    {
      "seq": 3,
      "ts": 0.04603706759279562,
      "type": "coordination_message",
      "actor": {
        "kind": "system",
        "id": "scheduler"
      },
      "payload": {
        "detail": "assign_task",
        "task_id": "centrifuge:1"
      },
      "state_hash_after": "5a9477e5978c0c24864e01b2cc2e69fcefe663c78a339846e4c2857c3e81605c"
    },
    {
      "seq": 4,
      "ts": 0.06081208465963972,
      "type": "task_start",
      "actor": {
        "kind": "agent",
        "id": "agent_1"
      },
      "payload": {
        "task_id": "centrifuge:1",
        "name": "centrifuge"
      },
      "state_hash_after": "015e89533d3c784608da5c34517ad1018a2254e4814ebbb77f3cc38890457fd8"
    },
    {
      "seq": 5,
      "ts": 0.07278332591349124,
      "type": "fault_injected",
      "actor": {
        "kind": "system",
        "id": "fault_injector"
      },
      "payload": {
        "fault": "drop_completion",
        "task_id": "centrifuge:1"
      },
      "state_hash_after": "034d5146ed367aeb888a0ce4a491fa1166e0b06334dc642b0b3893ee54d9e943"
    },
    {
      "seq": 6,
      "ts": 0.08937251447276831,
      "type": "coordination_message",
      "actor": {
        "kind": "system",
        "id": "scheduler"
      },
      "payload": {
        "detail": "assign_task",
        "task_id": "analyze:2"
      },
      "state_hash_after": "209e80de4698850efc8b27eea3cc774c23f3c773160bd8d44fdf1cadbedd97cc"
    },
    {
      "seq": 7,
      "ts": 0.11565865457454375,
      "type": "task_start",
      "actor": {
        "kind": "agent",
        "id": "agent_1"
      },
      "payload": {
        "task_id": "analyze:2",
        "name": "analyze"
      },
      "state_hash_after": "9711d7c592e4fda7e1ad34d1417bd759eca41d4ef2c59dbb96f8ca777e58183a"
    },
    {
      "seq": 8,
      "ts": 0.12169300111473223,
      "type": "fault_injected",
      "actor": {
        "kind": "system",
        "id": "fault_injector"
      },
      "payload": {
        "fault": "drop_completion",
        "task_id": "analyze:2"
      },
      "state_hash_after": "3cbb124ae1903c08d9613a8423c629a7707804ea3b02929c0042f9627837f42a"
    },
    {
      "seq": 9,
      "ts": 0.12327938796090632,
      "type": "coordination_message",
      "actor": {
        "kind": "system",
        "id": "scheduler"
      },
      "payload": {
        "detail": "assign_task",
        "task_id": "report_results:3"
      },
      "state_hash_after": "7cc215418c892c1be5bda953b48a30c22a87569a1ea42d42288913edf4afdb34"
    },
    {
      "seq": 10,
      "ts": 0.15096647631681587,
      "type": "task_start",
      "actor": {
        "kind": "agent",
        "id": "agent_1"
      },
      "payload": {
        "task_id": "report_results:3",
        "name": "report_results"
      },
      "state_hash_after": "c0b61c0a59b508b69e4e2fb3f167ce5de70d1f4a023a624d9c57ad41888e62d0"
    },
    {
      "seq": 11,
      "ts": 0.1516805354359494,
      "type": "task_end",
      "actor": {
        "kind": "tool",
        "id": "lab_device_1"
      },
      "payload": {
        "task_id": "report_results:3",
        "name": "report_results"
      },
      "state_hash_after": "85e4059b945e0b88955afa0b05a98df61eb814c9add053e3c314bf1e1f185b17"
    }
  ],
  "final_state_hash": "85e4059b945e0b88955afa0b05a98df61eb814c9add053e3c314bf1e1f185b17",
  "metadata": {
    "delay_p95_ms": 50.0,
    "drop_completion_prob": 0.4,
    "delay_fault_prob": 0.0,
    "calibration_invalid_prob": 0.0,
    "max_retries_per_task": 0,
    "rep_cps_scheduling_dependent": false,
    "rep_cps_safety_gate_ok": null,
    "planned_task_count": 4,
    "timeout_fault_prob": 0.0,
    "partial_result_fault_prob": 0.0,
    "reordered_event_fault_prob": 0.0,
    "resource_contention_spike_prob": 0.0,
    "invalid_action_injection_prob": 0.0,
    "agent_nonresponse_fault_prob": 0.0,
    "duplicate_completion_prob": 0.0,
    "conflicting_action_prob": 0.0,
    "constraint_guard_trigger_prob": 0.0,
    "sensor_stale_prob": 0.0,
    "shutdown_after_first_fault": false,
    "deadline_miss_prob": 0.0
  }
}
