{
  "version": "0.1",
  "run_id": "run_299679f01b",
  "scenario_id": "lab_profile_v0",
  "seed": 13,
  "start_time_utc": "2026-04-22T08:20:05.707515Z",
  "events": [
    {
      "seq": 0,
      "ts": 0.00500321934978929,
      "type": "coordination_message",
      "actor": {
        "kind": "system",
        "id": "scheduler"
      },
      "payload": {
        "detail": "assign_task",
        "task_id": "receive_sample:0",
        "regime": "centralized"
      },
      "state_hash_after": "b214ab65adc3ba8a83fc9daa540ff179100008a305fc4144936c77783af6d072"
    },
    {
      "seq": 1,
      "ts": 0.02429736674791074,
      "type": "task_start",
      "actor": {
        "kind": "agent",
        "id": "agent_1"
      },
      "payload": {
        "task_id": "receive_sample:0",
        "name": "receive_sample"
      },
      "state_hash_after": "b399f7cb3095b80e85ed05b05cce725373eca0dd73aa93672da0ef38ab30240c"
    },
    {
      "seq": 2,
      "ts": 0.028671764552330226,
      "type": "task_end",
      "actor": {
        "kind": "tool",
        "id": "lab_device_1"
      },
      "payload": {
        "task_id": "receive_sample:0",
        "name": "receive_sample"
      },
      "state_hash_after": "5b0650124328920a23401302b7680e5de8e1228feae6961531f65bccf57198ac"
    },
    {
      "seq": 3,
      "ts": 0.03132859787166141,
      "type": "coordination_message",
      "actor": {
        "kind": "system",
        "id": "scheduler"
      },
      "payload": {
        "detail": "assign_task",
        "task_id": "centrifuge:1",
        "regime": "centralized"
      },
      "state_hash_after": "5a9477e5978c0c24864e01b2cc2e69fcefe663c78a339846e4c2857c3e81605c"
    },
    {
      "seq": 4,
      "ts": 0.035586363383940334,
      "type": "task_start",
      "actor": {
        "kind": "agent",
        "id": "agent_1"
      },
      "payload": {
        "task_id": "centrifuge:1",
        "name": "centrifuge"
      },
      "state_hash_after": "015e89533d3c784608da5c34517ad1018a2254e4814ebbb77f3cc38890457fd8"
    },
    {
      "seq": 5,
      "ts": 0.03960342542103454,
      "type": "task_end",
      "actor": {
        "kind": "tool",
        "id": "lab_device_1"
      },
      "payload": {
        "task_id": "centrifuge:1",
        "name": "centrifuge"
      },
      "state_hash_after": "530abeb63c1a0a58143b8691dbdf5d290ace9721fc8e365e801c9403c26ff852"
    },
    {
      "seq": 6,
      "ts": 0.045429558878313785,
      "type": "coordination_message",
      "actor": {
        "kind": "system",
        "id": "scheduler"
      },
      "payload": {
        "detail": "assign_task",
        "task_id": "analyze:2",
        "regime": "centralized"
      },
      "state_hash_after": "1206209b42d875d68a2c6b8cf50ac80bb63988e9a4248e16d051fea386b6070d"
    },
    {
      "seq": 7,
      "ts": 0.054857892638392185,
      "type": "task_start",
      "actor": {
        "kind": "agent",
        "id": "agent_1"
      },
      "payload": {
        "task_id": "analyze:2",
        "name": "analyze"
      },
      "state_hash_after": "96937c93c2ed534e579f6f1f513f166007e57f76a897289ed523960581d5c59d"
    },
    {
      "seq": 8,
      "ts": 0.06024453174108659,
      "type": "fault_injected",
      "actor": {
        "kind": "system",
        "id": "fault_injector"
      },
      "payload": {
        "fault": "resource_contention_spike",
        "task_id": "analyze:2"
      },
      "state_hash_after": "ff18b2c3d722a6040eefe4207cbf0272dd699e766c89a5cbee118335535f766f"
    },
    {
      "seq": 9,
      "ts": 0.06289256860688819,
      "type": "resource_conflict",
      "actor": {
        "kind": "system",
        "id": "station_controller"
      },
      "payload": {
        "task_id": "analyze:2",
        "resource": "prep_station",
        "detail": "queue_spike"
      },
      "state_hash_after": "ff18b2c3d722a6040eefe4207cbf0272dd699e766c89a5cbee118335535f766f"
    },
    {
      "seq": 10,
      "ts": 0.09711045475230025,
      "type": "task_end",
      "actor": {
        "kind": "tool",
        "id": "lab_device_1"
      },
      "payload": {
        "task_id": "analyze:2",
        "name": "analyze"
      },
      "state_hash_after": "83007828b69af39399dbf286cde85978371c7ce2fccef984dbc1ce0f959206d8"
    },
    {
      "seq": 11,
      "ts": 0.12480588154983692,
      "type": "recovery_succeeded",
      "actor": {
        "kind": "system",
        "id": "supervisor"
      },
      "payload": {
        "task_id": "analyze:2",
        "detail": "task_completed_after_fault"
      },
      "state_hash_after": "83007828b69af39399dbf286cde85978371c7ce2fccef984dbc1ce0f959206d8"
    },
    {
      "seq": 12,
      "ts": 0.15218046700111726,
      "type": "coordination_message",
      "actor": {
        "kind": "system",
        "id": "scheduler"
      },
      "payload": {
        "detail": "assign_task",
        "task_id": "report_results:3",
        "regime": "centralized"
      },
      "state_hash_after": "f97b9fb9e65bd5161bcc21dfb63b64ccbe204c46d3a3112fce97db84070fade1"
    },
    {
      "seq": 13,
      "ts": 0.18140206765195338,
      "type": "task_start",
      "actor": {
        "kind": "agent",
        "id": "agent_1"
      },
      "payload": {
        "task_id": "report_results:3",
        "name": "report_results"
      },
      "state_hash_after": "df9311b20e974e15e9632d7a8d487c6fb81f4b9ff69a70f3cd4be5e7d9023a19"
    },
    {
      "seq": 14,
      "ts": 0.18635354948212535,
      "type": "task_end",
      "actor": {
        "kind": "tool",
        "id": "lab_device_1"
      },
      "payload": {
        "task_id": "report_results:3",
        "name": "report_results"
      },
      "state_hash_after": "eafe4b45d772cc47a5e509c70ef3d456bd59a22b8f5c6d673cb0f4533bd58573"
    },
    {
      "seq": 15,
      "ts": 0.21801047528289977,
      "type": "coordination_message",
      "actor": {
        "kind": "system",
        "id": "scheduler"
      },
      "payload": {
        "detail": "assign_task",
        "task_id": "disposition_commit:4",
        "regime": "centralized"
      },
      "state_hash_after": "760950b9e48a4616c66ecbf303eb6f4fed47e6837c8c162a1eef107d70ee6a48"
    },
    {
      "seq": 16,
      "ts": 0.2291440032163074,
      "type": "task_start",
      "actor": {
        "kind": "agent",
        "id": "agent_1"
      },
      "payload": {
        "task_id": "disposition_commit:4",
        "name": "disposition_commit"
      },
      "state_hash_after": "3c497f37abf762a8234cf93f46e5d48b8b339be2cbda40a23f029a342e5c04e9"
    },
    {
      "seq": 17,
      "ts": 0.23670267866127825,
      "type": "task_end",
      "actor": {
        "kind": "tool",
        "id": "lab_device_1"
      },
      "payload": {
        "task_id": "disposition_commit:4",
        "name": "disposition_commit"
      },
      "state_hash_after": "2adb7a100c29dd3eedf198adcb866c3329d42da105a7bb04250ff441f17ece4a"
    },
    {
      "seq": 18,
      "ts": 0.2460794705429456,
      "type": "safe_state_reached",
      "actor": {
        "kind": "system",
        "id": "supervisor"
      },
      "payload": {
        "detail": "all_tasks_terminal_safe"
      },
      "state_hash_after": "2adb7a100c29dd3eedf198adcb866c3329d42da105a7bb04250ff441f17ece4a"
    }
  ],
  "final_state_hash": "2adb7a100c29dd3eedf198adcb866c3329d42da105a7bb04250ff441f17ece4a",
  "metadata": {
    "delay_p95_ms": 50.0,
    "drop_completion_prob": 0.0,
    "delay_fault_prob": 0.0,
    "calibration_invalid_prob": 0.0,
    "max_retries_per_task": 0,
    "rep_cps_scheduling_dependent": false,
    "rep_cps_safety_gate_ok": null,
    "planned_task_count": 5,
    "timeout_fault_prob": 0.0,
    "partial_result_fault_prob": 0.0,
    "reordered_event_fault_prob": 0.0,
    "resource_contention_spike_prob": 0.02,
    "invalid_action_injection_prob": 0.0,
    "agent_nonresponse_fault_prob": 0.0,
    "duplicate_completion_prob": 0.0,
    "conflicting_action_prob": 0.0,
    "constraint_guard_trigger_prob": 0.0,
    "sensor_stale_prob": 0.0,
    "shutdown_after_first_fault": false,
    "deadline_miss_prob": 0.0,
    "fault_setting_label": "unknown",
    "agent_count": 1,
    "coordination_regime": "centralized",
    "coordination_topology": "centralized",
    "hierarchy_depth": 2,
    "fan_out": 1,
    "handoff_factor": 1,
    "shared_state_contention": 0.2,
    "deadline_tightness": 1.0,
    "critical_path_length": 5,
    "branching_factor": 1.0,
    "queue_contention_index": 0.2,
    "regime_fault_interaction": 0.0,
    "regime_id": 0,
    "effective_drop_completion_prob": 0.0,
    "latency_stress_multiplier": 1.0,
    "drop_stress_multiplier": 1.0
  }
}
