{
  "version": "0.1",
  "run_id": "run_0c006b0b05",
  "scenario_id": "regime_stress_v0",
  "seed": 4,
  "start_time_utc": "2026-03-18T21:11:41.324090Z",
  "events": [
    {
      "seq": 0,
      "ts": 0.004493900186878124,
      "type": "coordination_message",
      "actor": {
        "kind": "system",
        "id": "scheduler"
      },
      "payload": {
        "detail": "assign_task",
        "task_id": "receive_sample:0"
      },
      "state_hash_after": "b214ab65adc3ba8a83fc9daa540ff179100008a305fc4144936c77783af6d072"
    },
    {
      "seq": 1,
      "ts": 0.006311227697991413,
      "type": "task_start",
      "actor": {
        "kind": "agent",
        "id": "agent_1"
      },
      "payload": {
        "task_id": "receive_sample:0",
        "name": "receive_sample"
      },
      "state_hash_after": "b399f7cb3095b80e85ed05b05cce725373eca0dd73aa93672da0ef38ab30240c"
    },
    {
      "seq": 2,
      "ts": 0.009121656353973571,
      "type": "task_end",
      "actor": {
        "kind": "tool",
        "id": "lab_device_1"
      },
      "payload": {
        "task_id": "receive_sample:0",
        "name": "receive_sample"
      },
      "state_hash_after": "5b0650124328920a23401302b7680e5de8e1228feae6961531f65bccf57198ac"
    },
    {
      "seq": 3,
      "ts": 0.01027046540799803,
      "type": "coordination_message",
      "actor": {
        "kind": "system",
        "id": "scheduler"
      },
      "payload": {
        "detail": "assign_task",
        "task_id": "centrifuge:1"
      },
      "state_hash_after": "5a9477e5978c0c24864e01b2cc2e69fcefe663c78a339846e4c2857c3e81605c"
    },
    {
      "seq": 4,
      "ts": 0.018840671114745453,
      "type": "task_start",
      "actor": {
        "kind": "agent",
        "id": "agent_1"
      },
      "payload": {
        "task_id": "centrifuge:1",
        "name": "centrifuge"
      },
      "state_hash_after": "015e89533d3c784608da5c34517ad1018a2254e4814ebbb77f3cc38890457fd8"
    },
    {
      "seq": 5,
      "ts": 0.045740642213261004,
      "type": "task_end",
      "actor": {
        "kind": "tool",
        "id": "lab_device_1"
      },
      "payload": {
        "task_id": "centrifuge:1",
        "name": "centrifuge"
      },
      "state_hash_after": "530abeb63c1a0a58143b8691dbdf5d290ace9721fc8e365e801c9403c26ff852"
    },
    {
      "seq": 6,
      "ts": 0.0699227419067884,
      "type": "coordination_message",
      "actor": {
        "kind": "system",
        "id": "scheduler"
      },
      "payload": {
        "detail": "assign_task",
        "task_id": "analyze:2"
      },
      "state_hash_after": "1206209b42d875d68a2c6b8cf50ac80bb63988e9a4248e16d051fea386b6070d"
    },
    {
      "seq": 7,
      "ts": 0.07411097398139703,
      "type": "task_start",
      "actor": {
        "kind": "agent",
        "id": "agent_1"
      },
      "payload": {
        "task_id": "analyze:2",
        "name": "analyze"
      },
      "state_hash_after": "96937c93c2ed534e579f6f1f513f166007e57f76a897289ed523960581d5c59d"
    },
    {
      "seq": 8,
      "ts": 0.07951711811393804,
      "type": "task_end",
      "actor": {
        "kind": "tool",
        "id": "lab_device_1"
      },
      "payload": {
        "task_id": "analyze:2",
        "name": "analyze"
      },
      "state_hash_after": "add37ab12b6d9f0390d3e0e873b1309437fd15a5a79234864d39d357612188ac"
    },
    {
      "seq": 9,
      "ts": 0.08268070219159171,
      "type": "coordination_message",
      "actor": {
        "kind": "system",
        "id": "scheduler"
      },
      "payload": {
        "detail": "assign_task",
        "task_id": "report_results:3"
      },
      "state_hash_after": "9333ad6003f3d687c0c40444fcc63711588ff94c9cd5ce0c250624c3d04856de"
    },
    {
      "seq": 10,
      "ts": 0.08455427665803032,
      "type": "task_start",
      "actor": {
        "kind": "agent",
        "id": "agent_1"
      },
      "payload": {
        "task_id": "report_results:3",
        "name": "report_results"
      },
      "state_hash_after": "0e2bc6a80ed18582e06de86e5b421982de50ffee7046c9d3085945ce297bd55e"
    },
    {
      "seq": 11,
      "ts": 0.12834711953864847,
      "type": "task_end",
      "actor": {
        "kind": "tool",
        "id": "lab_device_1"
      },
      "payload": {
        "task_id": "report_results:3",
        "name": "report_results"
      },
      "state_hash_after": "858a864b8107df1c6d5b730ba66b02d3b537faac680d1ce7969a2972e741b9b0"
    }
  ],
  "final_state_hash": "858a864b8107df1c6d5b730ba66b02d3b537faac680d1ce7969a2972e741b9b0",
  "metadata": {
    "delay_p95_ms": 50.0,
    "drop_completion_prob": 0.15,
    "delay_fault_prob": 0.0,
    "calibration_invalid_prob": 0.0,
    "max_retries_per_task": 0,
    "meta_controller": true,
    "regime_switch_count": 0
  }
}
