{
  "version": "0.1",
  "run_id": "run_35037f78b0",
  "scenario_id": "regime_stress_v1",
  "seed": 5,
  "start_time_utc": "2026-04-20T06:22:00.788345Z",
  "events": [
    {
      "seq": 0,
      "ts": 0.016277311859170335,
      "type": "coordination_message",
      "actor": {
        "kind": "system",
        "id": "scheduler"
      },
      "payload": {
        "detail": "assign_task",
        "task_id": "receive_sample:0",
        "regime": "centralized"
      },
      "state_hash_after": "b214ab65adc3ba8a83fc9daa540ff179100008a305fc4144936c77783af6d072"
    },
    {
      "seq": 1,
      "ts": 0.03887563320503967,
      "type": "task_start",
      "actor": {
        "kind": "agent",
        "id": "agent_1"
      },
      "payload": {
        "task_id": "receive_sample:0",
        "name": "receive_sample"
      },
      "state_hash_after": "b399f7cb3095b80e85ed05b05cce725373eca0dd73aa93672da0ef38ab30240c"
    },
    {
      "seq": 2,
      "ts": 0.0865285242860657,
      "type": "task_end",
      "actor": {
        "kind": "tool",
        "id": "lab_device_1"
      },
      "payload": {
        "task_id": "receive_sample:0",
        "name": "receive_sample"
      },
      "state_hash_after": "5b0650124328920a23401302b7680e5de8e1228feae6961531f65bccf57198ac"
    },
    {
      "seq": 3,
      "ts": 0.10900522620580984,
      "type": "coordination_message",
      "actor": {
        "kind": "system",
        "id": "scheduler"
      },
      "payload": {
        "detail": "assign_task",
        "task_id": "centrifuge:1",
        "regime": "centralized"
      },
      "state_hash_after": "5a9477e5978c0c24864e01b2cc2e69fcefe663c78a339846e4c2857c3e81605c"
    },
    {
      "seq": 4,
      "ts": 0.15165292545667944,
      "type": "task_start",
      "actor": {
        "kind": "agent",
        "id": "agent_1"
      },
      "payload": {
        "task_id": "centrifuge:1",
        "name": "centrifuge"
      },
      "state_hash_after": "015e89533d3c784608da5c34517ad1018a2254e4814ebbb77f3cc38890457fd8"
    },
    {
      "seq": 5,
      "ts": 0.1621120218079272,
      "type": "fault_injected",
      "actor": {
        "kind": "system",
        "id": "fault_injector"
      },
      "payload": {
        "fault": "drop_completion",
        "task_id": "centrifuge:1"
      },
      "state_hash_after": "034d5146ed367aeb888a0ce4a491fa1166e0b06334dc642b0b3893ee54d9e943"
    },
    {
      "seq": 6,
      "ts": 0.2100298863985111,
      "type": "coordination_message",
      "actor": {
        "kind": "system",
        "id": "scheduler"
      },
      "payload": {
        "detail": "assign_task",
        "task_id": "analyze:2",
        "regime": "centralized"
      },
      "state_hash_after": "209e80de4698850efc8b27eea3cc774c23f3c773160bd8d44fdf1cadbedd97cc"
    },
    {
      "seq": 7,
      "ts": 0.22750301924820915,
      "type": "task_start",
      "actor": {
        "kind": "agent",
        "id": "agent_1"
      },
      "payload": {
        "task_id": "analyze:2",
        "name": "analyze"
      },
      "state_hash_after": "9711d7c592e4fda7e1ad34d1417bd759eca41d4ef2c59dbb96f8ca777e58183a"
    },
    {
      "seq": 8,
      "ts": 0.2295082472915191,
      "type": "task_end",
      "actor": {
        "kind": "tool",
        "id": "lab_device_1"
      },
      "payload": {
        "task_id": "analyze:2",
        "name": "analyze"
      },
      "state_hash_after": "139aff29e6d55c21557282c08099ea36b2a0de4aa22ebffab8c4672ce6bc3a45"
    },
    {
      "seq": 9,
      "ts": 0.24007533476579876,
      "type": "coordination_message",
      "actor": {
        "kind": "system",
        "id": "scheduler"
      },
      "payload": {
        "detail": "assign_task",
        "task_id": "report_results:3",
        "regime": "centralized"
      },
      "state_hash_after": "344c2e282ac71b4de080cbb59cdb1beef7eff728a9d5f18e0aceb37a2731e165"
    },
    {
      "seq": 10,
      "ts": 0.24480077246880722,
      "type": "task_start",
      "actor": {
        "kind": "agent",
        "id": "agent_1"
      },
      "payload": {
        "task_id": "report_results:3",
        "name": "report_results"
      },
      "state_hash_after": "4d79e981816a2a2219d37d97dfae3b896e2f777482b3345b68ce47e6f70f5959"
    },
    {
      "seq": 11,
      "ts": 0.25904066121431774,
      "type": "task_end",
      "actor": {
        "kind": "tool",
        "id": "lab_device_1"
      },
      "payload": {
        "task_id": "report_results:3",
        "name": "report_results"
      },
      "state_hash_after": "b055a2e0a73661510c820cc479587d1e5451326d5f7868e7493cccaa5e06e430"
    }
  ],
  "final_state_hash": "b055a2e0a73661510c820cc479587d1e5451326d5f7868e7493cccaa5e06e430",
  "metadata": {
    "delay_p95_ms": 50.0,
    "drop_completion_prob": 0.4,
    "delay_fault_prob": 0.0,
    "calibration_invalid_prob": 0.0,
    "max_retries_per_task": 0,
    "rep_cps_scheduling_dependent": false,
    "rep_cps_safety_gate_ok": null,
    "planned_task_count": 4,
    "timeout_fault_prob": 0.0,
    "partial_result_fault_prob": 0.0,
    "reordered_event_fault_prob": 0.0,
    "resource_contention_spike_prob": 0.0,
    "invalid_action_injection_prob": 0.0,
    "agent_nonresponse_fault_prob": 0.0,
    "duplicate_completion_prob": 0.0,
    "conflicting_action_prob": 0.0,
    "constraint_guard_trigger_prob": 0.0,
    "sensor_stale_prob": 0.0,
    "shutdown_after_first_fault": false,
    "deadline_miss_prob": 0.0,
    "fault_setting_label": "unknown",
    "agent_count": 1,
    "coordination_regime": "centralized",
    "coordination_topology": "centralized",
    "hierarchy_depth": 2,
    "fan_out": 1,
    "handoff_factor": 1,
    "shared_state_contention": 0.25,
    "deadline_tightness": 1.0,
    "critical_path_length": 4,
    "branching_factor": 1.0,
    "queue_contention_index": 0.25,
    "regime_fault_interaction": 0.0,
    "regime_id": 0,
    "effective_drop_completion_prob": 0.4,
    "latency_stress_multiplier": 1.0,
    "drop_stress_multiplier": 1.0
  }
}
